{
  "server_time": "2026-10-27T10:05:12.345Z",
  "route": {
    "id": "019a2b3c-4d5e-7f00-8a00-000000000007",
    "site_id": "019a2b3c-4d5e-7f00-8a00-000000000001",
    "name": "Éjszakai kör",
    "order_mode": "fixed",
    "current_version_id": "019a2b3c-4d5e-7f00-8a00-000000000008",
    "active": true,
    "created_at": "2026-10-20T08:00:00.000Z",
    "updated_at": "2026-10-27T10:05:12.345Z"
  },
  "route_version": {
    "id": "019a2b3c-4d5e-7f00-8a00-000000000008",
    "route_id": "019a2b3c-4d5e-7f00-8a00-000000000007",
    "version": 1,
    "walk_duration_s": 840,
    "created_by": "019a2b3c-4d5e-7f00-8a00-000000000002",
    "created_at": "2026-10-20T08:00:00.000Z"
  },
  "route_version_checkpoints": [
    {
      "route_version_id": "019a2b3c-4d5e-7f00-8a00-000000000008",
      "checkpoint_id": "019a2b3c-4d5e-7f00-8a00-000000000005",
      "position": 1,
      "walk_time_from_prev_s": null
    },
    {
      "route_version_id": "019a2b3c-4d5e-7f00-8a00-000000000008",
      "checkpoint_id": "019a2b3c-4d5e-7f00-8a00-000000000005",
      "position": 2,
      "walk_time_from_prev_s": 95
    }
  ]
}
